{
  "$schema": "../../schemas/no-hierarquia.schema.json",
  "id": "cat.cozinha.balcoes",
  "tipo": "categoria",
  "nome": "Balcões",
  "pai": "linha.cozinha-essencial",
  "descricao": "Módulos inferiores. A categoria liga o rodapé recuado (o padrão de fábrica vem sem rodapé porque aéreos não têm) e fixa altura/profundidade padrão.",
  "sobrescrever": {
    "construcao": { "rodape": { "tipo": "rodape", "altura": 100, "recuo": 50 } }
  },
  "parametrosPadrao": { "A": 720, "P": 530 }
}
