{
  "$schema": "../../schemas/no-hierarquia.schema.json",
  "id": "linha.cozinha-essencial",
  "tipo": "linha",
  "nome": "Cozinha Essencial",
  "pai": "fab.exemplo",
  "descricao": "Linha de entrada: caixa em MDF 15 mm. Uma única troca de material e todas as peças, vãos, frentes e gavetas se recalculam — nenhuma fórmula de módulo é tocada.",
  "sobrescrever": {
    "acabamentos": { "estrutura": "MDF15_BRANCO_TX" }
  }
}
